<?xml version="1.0" encoding="UTF-8"?><!--DTD generated by XMLSPY v2004 rel. 3 U (http://www.xmlspy.com)--><!ELEMENT definition (#PCDATA | title)*><!ELEMENT glossary (item+)><!ELEMENT item (title, definition)><!ELEMENT title (#PCDATA)><!ATTLIST title	version CDATA #IMPLIED>